{
  "schema": "receiptos_chronicle_admission_vector.v0",
  "case_id": "evidence_root_mismatch",
  "description": "Stored evidence root does not match independent recomputation.",
  "input": {
    "evidence": {
      "schema": "stealth.session.evidence.v1",
      "session_id": "session-demo-001",
      "directory": "C:/demo/workspace",
      "task": {
        "title": "Portable ReceiptOS evidence core sample (tampered)",
        "prompt": "Verify portable receipt_root parity."
      },
      "agent": {
        "id": "stealth-main",
        "runtime": "Stealth"
      },
      "scope": {
        "permission": null,
        "lease": {
          "id": "session-demo-001:scoped-lease:v1",
          "mode": "read_only",
          "target": "C:/demo/workspace",
          "allowed_actions": [],
          "issued_at": 1718676000,
          "expires_at": null,
          "status": "missing"
        }
      },
      "authorization": {
        "delegation_ref": null,
        "delegator": null,
        "agent_operator": "stealth-main",
        "target": "C:/demo/workspace",
        "allowed_actions": [],
        "authorization_valid_from": null,
        "authorization_expiry": null,
        "authorization_checked_at": 1718676060,
        "authorization_state_hash": "e3b0c44298fc1c149afbf4c8996fb92427ae41e4649b934ca495991b7852b855",
        "authorized_at_execution": null
      },
      "execution": [
        {
          "call_id": "call-demo-001",
          "tool": "exec",
          "action_performed": "git status --short",
          "target": "C:/demo/workspace",
          "execution_timestamp": 1718676020,
          "completed_timestamp": 1718676021,
          "status": "completed",
          "scope_match": null
        }
      ],
      "commands": [
        {
          "command": "git status --short",
          "exit_code": 0,
          "stdout_summary": " M src/demo.txt"
        }
      ],
      "changes": {
        "files_changed": [
          "src/demo.txt"
        ],
        "diff_sha256": "4d5e8d336a6f2d0d45d76c6f9d1fd8013a4a8b4f28e8c5cad20c4d5f0f1a0abc"
      },
      "anchor": {
        "receipt_root": "0x687dc5c00d9241469138bb1c17a06af1b8713b0f84663b55e11d476f4171a6bc",
        "merkle_proof_status": "not attached",
        "merkle_root": null,
        "merkle_leaf_index": null,
        "merkle_proof": [],
        "onchain_anchor_status": "not anchored",
        "network": "local/off-chain",
        "contract": null,
        "tx_hash": null,
        "verifier_status": "not verified"
      },
      "metadata": {
        "message_count": 3,
        "diff_count": 1,
        "generated_by": "stealth.handoff.evidence.builder.v1"
      }
    },
    "proof_object": {
      "schema": "receiptos.portable_proof_object.v0",
      "proof_object_id": "proofobj-687dc5c00d9241469138bb1c17a06af1b8713b0f84663b55e11d476f4171a6bc",
      "proof_system": "ReceiptOS",
      "receipt_root": "0x687dc5c00d9241469138bb1c17a06af1b8713b0f84663b55e11d476f4171a6bc",
      "proof_ref": "receiptos://portable-proof-object/proofobj-687dc5c00d9241469138bb1c17a06af1b8713b0f84663b55e11d476f4171a6bc",
      "replay_ref": "receiptos://replay/session-demo-001",
      "anchor_ref": null,
      "created_at": "2024-06-18T02:00:21.000Z",
      "relation_type": "imported",
      "project_refs": [
        "workspace"
      ],
      "source_evidence_ref": "shared-vector://tampered-evidence",
      "producer": {
        "runtime": "Stealth",
        "agent_id": "stealth-main",
        "generated_by": "stealth.handoff.evidence.builder.v1",
        "source_schema": "stealth.session.evidence.v1"
      },
      "metadata": {
        "label": "Portable ReceiptOS evidence core sample (tampered)",
        "session_id": "session-demo-001",
        "directory": "C:/demo/workspace",
        "position_id": "workspace"
      },
      "evidence_capsule": {
        "schema": "receiptos.evidence_capsule.v0",
        "action": {
          "summary": "Portable ReceiptOS evidence core sample (tampered)",
          "source_fields": [
            "task.title",
            "task.prompt",
            "commands"
          ]
        },
        "evidence": {
          "summary": "1 changed file(s); diff count 1.",
          "source_fields": [
            "changes.files_changed",
            "changes.diff_sha256",
            "metadata.diff_count",
            "metadata.message_count"
          ],
          "status": "present"
        },
        "receipt_root": {
          "stored": "0x687dc5c00d9241469138bb1c17a06af1b8713b0f84663b55e11d476f4171a6bc",
          "computed": "0x1c0b2bbced04dabf8ae4bad9649c76a1531ad569bc4df8e74704f63cd79ba570",
          "match": false,
          "status": "mismatch"
        },
        "proof_refs": {
          "merkle": {
            "present": false,
            "status": "missing"
          },
          "anchor": {
            "status": "missing"
          }
        },
        "verifier_result": {
          "ok": false,
          "status": "mismatch"
        },
        "capsule": {
          "sections": [
            {
              "id": "payload",
              "label": "Payload / Action",
              "status": "present",
              "summary": "Portable ReceiptOS evidence core sample (tampered)",
              "sourceFields": [
                "task.title",
                "task.prompt",
                "commands"
              ]
            },
            {
              "id": "policy_boundary",
              "label": "Policy Boundary",
              "status": "present",
              "summary": "Scope lease missing in mode read_only.",
              "sourceFields": [
                "scope.permission",
                "scope.lease"
              ]
            },
            {
              "id": "authorization",
              "label": "Authorization",
              "status": "present",
              "summary": "0 allowed action rule(s).",
              "sourceFields": [
                "authorization.allowed_actions",
                "authorization.authorization_state_hash",
                "authorization.authorized_at_execution"
              ]
            },
            {
              "id": "decision_trace",
              "label": "Decision Trace",
              "status": "present",
              "summary": "Decision trace recorded via title: Portable ReceiptOS evidence core sample (tampered), prompt present, 1 command(s), 1 execution step(s).",
              "sourceFields": [
                "task.title",
                "task.prompt",
                "commands",
                "execution",
                "authorization.authorized_at_execution"
              ]
            },
            {
              "id": "execution",
              "label": "Execution",
              "status": "present",
              "summary": "1 execution record(s); 1 completed, 0 error.",
              "sourceFields": [
                "execution",
                "commands"
              ]
            },
            {
              "id": "evidence",
              "label": "Evidence Record",
              "status": "present",
              "summary": "1 changed file(s); diff count 1.",
              "sourceFields": [
                "changes.files_changed",
                "changes.diff_sha256",
                "metadata.diff_count",
                "metadata.message_count"
              ]
            },
            {
              "id": "counterfactual",
              "label": "Counterfactual / Denied Action",
              "status": "missing",
              "summary": "No explicit denied-action / counterfactual evidence is recorded in the current receipt schema.",
              "sourceFields": [
                "authorization.allowed_actions",
                "execution.status",
                "commands.exit_code"
              ]
            },
            {
              "id": "result",
              "label": "Result",
              "status": "present",
              "summary": "Recorded result data is internally consistent.",
              "sourceFields": [
                "commands.exit_code",
                "commands.stdout_summary"
              ]
            },
            {
              "id": "receipt_root",
              "label": "Receipt Root",
              "status": "mismatch",
              "summary": "Stored receipt_root does not match recomputed canonical root.",
              "sourceFields": [
                "anchor.receipt_root"
              ]
            },
            {
              "id": "merkle",
              "label": "Merkle Proof",
              "status": "pending",
              "summary": "No local Merkle proof attached yet.",
              "sourceFields": [
                "anchor.merkle_proof_status",
                "anchor.merkle_root",
                "anchor.merkle_leaf_index",
                "anchor.merkle_proof"
              ]
            },
            {
              "id": "anchor",
              "label": "Anchor",
              "status": "missing",
              "summary": "No external anchor recorded.",
              "sourceFields": [
                "anchor.onchain_anchor_status",
                "anchor.network",
                "anchor.contract",
                "anchor.tx_hash"
              ]
            },
            {
              "id": "replay_manifest",
              "label": "Replay Manifest",
              "status": "present",
              "summary": "Replay inputs include session/task context, 1 command(s), diff hash state, and 1 anchor reference(s).",
              "sourceFields": [
                "session_id",
                "directory",
                "task",
                "commands",
                "changes.diff_sha256",
                "anchor.receipt_root",
                "anchor.merkle_root",
                "anchor.tx_hash",
                "metadata.generated_by"
              ]
            },
            {
              "id": "verifier",
              "label": "Verifier",